<?xml version="1.0" encoding="UTF-8"?>
<cv24:cv24 xmlns:cv24="http://univ.fr/cv24" xmlns:xsi="http://www.w3.org/2001/XMLSchema-instance" xsi:schemaLocation="http://univ.fr/cv24 cv24.xsd ">
  <cv24:identite>
    <cv24:Genre>M.</cv24:Genre>
    <cv24:nom>NOM</cv24:nom>
    <cv24:prenom>prenom</cv24:prenom>
  </cv24:identite>
  <cv24:objectif status="stage">objectif</cv24:objectif>
  <cv24:competences>
    <cv24:diplome niveau="2">
      <cv24:titre>Test</cv24:titre>
      <cv24:date>2001-01-01</cv24:date>
      <cv24:institut>Univrsit√© de rouen</cv24:institut>
    </cv24:diplome>
    <cv24:certif>
      <cv24:datedeb>2001-01-01</cv24:datedeb>
      <cv24:titre>titre</cv24:titre>
    </cv24:certif>
  </cv24:competences>
</cv24:cv24>
